{
  "schema_version": "proposition-visual-binding-v0.1",
  "report_type": "semantic_binding_predictions",
  "case_id": "lesson_012",
  "method": {
    "name": "lexical_jaccard",
    "version": "lexical-jaccard-v0.1",
    "uses_external_model": false,
    "threshold": 0.08,
    "tie_margin": 0.02,
    "max_targets": 1
  },
  "bindings": [
    {
      "binding_id": "lesson_012-binding-0001",
      "segment_id": "lesson-012-seg-001",
      "narration_proposition_id": "lesson-012-nprop-s001-p001",
      "status": "bound",
      "target_element_ids": [
        "lesson-012-seg-001-el-002"
      ],
      "ranked_candidates": [
        {
          "element_id": "lesson-012-seg-001-el-002",
          "score": 0.314286,
          "element_text": "《数字素养》课程 - 第1讲"
        },
        {
          "element_id": "lesson-012-seg-001-el-005",
          "score": 0.060241,
          "element_text": "从“结绳记事”到数字世界，我们将探讨数据的演变及其在当代社会中的作用。"
        },
        {
          "element_id": "lesson-012-seg-001-el-001",
          "score": 0.04,
          "element_text": "数据：从原始记事到现代资源"
        },
        {
          "element_id": "lesson-012-seg-001-el-004",
          "score": 0.038961,
          "element_text": "数据不仅是数字，更是信息的载体，是推动现代社会发展的关键力量。"
        },
        {
          "element_id": "lesson-012-seg-001-el-003",
          "score": 0.0,
          "element_text": "记录 信息 资源 科技 社会"
        }
      ],
      "confidence": 0.314286,
      "binding_source": "lexical_jaccard",
      "rationale": "selected highest lexical Jaccard candidate(s) above threshold"
    },
    {
      "binding_id": "lesson_012-binding-0002",
      "segment_id": "lesson-012-seg-001",
      "narration_proposition_id": "lesson-012-nprop-s001-p002",
      "status": "bound",
      "target_element_ids": [
        "lesson-012-seg-001-el-005"
      ],
      "ranked_candidates": [
        {
          "element_id": "lesson-012-seg-001-el-005",
          "score": 0.136842,
          "element_text": "从“结绳记事”到数字世界，我们将探讨数据的演变及其在当代社会中的作用。"
        },
        {
          "element_id": "lesson-012-seg-001-el-001",
          "score": 0.043478,
          "element_text": "数据：从原始记事到现代资源"
        },
        {
          "element_id": "lesson-012-seg-001-el-004",
          "score": 0.041667,
          "element_text": "数据不仅是数字，更是信息的载体，是推动现代社会发展的关键力量。"
        },
        {
          "element_id": "lesson-012-seg-001-el-002",
          "score": 0.015385,
          "element_text": "《数字素养》课程 - 第1讲"
        },
        {
          "element_id": "lesson-012-seg-001-el-003",
          "score": 0.0,
          "element_text": "记录 信息 资源 科技 社会"
        }
      ],
      "confidence": 0.136842,
      "binding_source": "lexical_jaccard",
      "rationale": "selected highest lexical Jaccard candidate(s) above threshold"
    },
    {
      "binding_id": "lesson_012-binding-0003",
      "segment_id": "lesson-012-seg-001",
      "narration_proposition_id": "lesson-012-nprop-s001-p003",
      "status": "bound",
      "target_element_ids": [
        "lesson-012-seg-001-el-004"
      ],
      "ranked_candidates": [
        {
          "element_id": "lesson-012-seg-001-el-004",
          "score": 1.0,
          "element_text": "数据不仅是数字，更是信息的载体，是推动现代社会发展的关键力量。"
        },
        {
          "element_id": "lesson-012-seg-001-el-005",
          "score": 0.111111,
          "element_text": "从“结绳记事”到数字世界，我们将探讨数据的演变及其在当代社会中的作用。"
        },
        {
          "element_id": "lesson-012-seg-001-el-003",
          "score": 0.09375,
          "element_text": "记录 信息 资源 科技 社会"
        },
        {
          "element_id": "lesson-012-seg-001-el-001",
          "score": 0.088235,
          "element_text": "数据：从原始记事到现代资源"
        },
        {
          "element_id": "lesson-012-seg-001-el-002",
          "score": 0.046154,
          "element_text": "《数字素养》课程 - 第1讲"
        }
      ],
      "confidence": 1.0,
      "binding_source": "lexical_jaccard",
      "rationale": "selected highest lexical Jaccard candidate(s) above threshold"
    },
    {
      "binding_id": "lesson_012-binding-0004",
      "segment_id": "lesson-012-seg-001",
      "narration_proposition_id": "lesson-012-nprop-s001-p004",
      "status": "bound",
      "target_element_ids": [
        "lesson-012-seg-001-el-005"
      ],
      "ranked_candidates": [
        {
          "element_id": "lesson-012-seg-001-el-005",
          "score": 0.130435,
          "element_text": "从“结绳记事”到数字世界，我们将探讨数据的演变及其在当代社会中的作用。"
        },
        {
          "element_id": "lesson-012-seg-001-el-001",
          "score": 0.105263,
          "element_text": "数据：从原始记事到现代资源"
        },
        {
          "element_id": "lesson-012-seg-001-el-004",
          "score": 0.060606,
          "element_text": "数据不仅是数字，更是信息的载体，是推动现代社会发展的关键力量。"
        },
        {
          "element_id": "lesson-012-seg-001-el-002",
          "score": 0.028571,
          "element_text": "《数字素养》课程 - 第1讲"
        },
        {
          "element_id": "lesson-012-seg-001-el-003",
          "score": 0.0,
          "element_text": "记录 信息 资源 科技 社会"
        }
      ],
      "confidence": 0.130435,
      "binding_source": "lexical_jaccard",
      "rationale": "selected highest lexical Jaccard candidate(s) above threshold"
    },
    {
      "binding_id": "lesson_012-binding-0005",
      "segment_id": "lesson-012-seg-001",
      "narration_proposition_id": "lesson-012-nprop-s001-p005",
      "status": "bound",
      "target_element_ids": [
        "lesson-012-seg-001-el-001"
      ],
      "ranked_candidates": [
        {
          "element_id": "lesson-012-seg-001-el-001",
          "score": 0.240741,
          "element_text": "数据：从原始记事到现代资源"
        },
        {
          "element_id": "lesson-012-seg-001-el-003",
          "score": 0.067797,
          "element_text": "记录 信息 资源 科技 社会"
        },
        {
          "element_id": "lesson-012-seg-001-el-004",
          "score": 0.067416,
          "element_text": "数据不仅是数字，更是信息的载体，是推动现代社会发展的关键力量。"
        },
        {
          "element_id": "lesson-012-seg-001-el-005",
          "score": 0.061856,
          "element_text": "从“结绳记事”到数字世界，我们将探讨数据的演变及其在当代社会中的作用。"
        },
        {
          "element_id": "lesson-012-seg-001-el-002",
          "score": 0.0,
          "element_text": "《数字素养》课程 - 第1讲"
        }
      ],
      "confidence": 0.240741,
      "binding_source": "lexical_jaccard",
      "rationale": "selected highest lexical Jaccard candidate(s) above threshold"
    },
    {
      "binding_id": "lesson_012-binding-0006",
      "segment_id": "lesson-012-seg-002",
      "narration_proposition_id": "lesson-012-nprop-s002-p001",
      "status": "bound",
      "target_element_ids": [
        "lesson-012-seg-002-el-002"
      ],
      "ranked_candidates": [
        {
          "element_id": "lesson-012-seg-002-el-002",
          "score": 0.244444,
          "element_text": "中国原始社会 西方文化"
        },
        {
          "element_id": "lesson-012-seg-002-el-004",
          "score": 0.066667,
          "element_text": "结绳 书卷 数据"
        },
        {
          "element_id": "lesson-012-seg-002-el-001",
          "score": 0.0,
          "element_text": "数据的起源与文化差异"
        },
        {
          "element_id": "lesson-012-seg-002-el-003",
          "score": 0.0,
          "element_text": "两种文化对数据的理解虽有差异，但都体现了“数据”作为信息载体的早期实践。"
        }
      ],
      "confidence": 0.244444,
      "binding_source": "lexical_jaccard",
      "rationale": "selected highest lexical Jaccard candidate(s) above threshold"
    },
    {
      "binding_id": "lesson_012-binding-0007",
      "segment_id": "lesson-012-seg-002",
      "narration_proposition_id": "lesson-012-nprop-s002-p002",
      "status": "bound",
      "target_element_ids": [
        "lesson-012-seg-002-el-003"
      ],
      "ranked_candidates": [
        {
          "element_id": "lesson-012-seg-002-el-003",
          "score": 0.125,
          "element_text": "两种文化对数据的理解虽有差异，但都体现了“数据”作为信息载体的早期实践。"
        },
        {
          "element_id": "lesson-012-seg-002-el-001",
          "score": 0.071429,
          "element_text": "数据的起源与文化差异"
        },
        {
          "element_id": "lesson-012-seg-002-el-004",
          "score": 0.04,
          "element_text": "结绳 书卷 数据"
        },
        {
          "element_id": "lesson-012-seg-002-el-002",
          "score": 0.016949,
          "element_text": "中国原始社会 西方文化"
        }
      ],
      "confidence": 0.125,
      "binding_source": "lexical_jaccard",
      "rationale": "selected highest lexical Jaccard candidate(s) above threshold"
    },
    {
      "binding_id": "lesson_012-binding-0008",
      "segment_id": "lesson-012-seg-002",
      "narration_proposition_id": "lesson-012-nprop-s002-p003",
      "status": "abstained",
      "target_element_ids": [],
      "ranked_candidates": [
        {
          "element_id": "lesson-012-seg-002-el-001",
          "score": 0.063492,
          "element_text": "数据的起源与文化差异"
        },
        {
          "element_id": "lesson-012-seg-002-el-002",
          "score": 0.063492,
          "element_text": "中国原始社会 西方文化"
        },
        {
          "element_id": "lesson-012-seg-002-el-003",
          "score": 0.06,
          "element_text": "两种文化对数据的理解虽有差异，但都体现了“数据”作为信息载体的早期实践。"
        },
        {
          "element_id": "lesson-012-seg-002-el-004",
          "score": 0.053571,
          "element_text": "结绳 书卷 数据"
        }
      ],
      "confidence": 0.063492,
      "binding_source": "lexical_jaccard",
      "rationale": "no lexical candidate reached the configured threshold"
    },
    {
      "binding_id": "lesson_012-binding-0009",
      "segment_id": "lesson-012-seg-002",
      "narration_proposition_id": "lesson-012-nprop-s002-p004",
      "status": "abstained",
      "target_element_ids": [],
      "ranked_candidates": [
        {
          "element_id": "lesson-012-seg-002-el-001",
          "score": 0.066667,
          "element_text": "数据的起源与文化差异"
        },
        {
          "element_id": "lesson-012-seg-002-el-004",